{
  "$schema": "https://json-schema.org/draft/2020-12/schema",
  "$id": "urn:kingdom:schema:civilisation-reality-projection:0.1",
  "title": "KINGDOM Civilisation → Reality Projection 0.1",
  "description": "A closed, thin crosswalk between two immutable KINGDOM predecessors. Schema validity establishes no historical completeness, causal effect, metaphysical verdict, score, authority, consent, action, or external-world change.",
  "type": "object",
  "additionalProperties": false,
  "required": [
    "$schema",
    "protocol",
    "projection_id",
    "version",
    "title",
    "compiled_on",
    "evidence_through",
    "state",
    "scope",
    "projection_rules",
    "predecessor_bindings",
    "crosswalks",
    "open_domains",
    "boundaries",
    "integrity"
  ],
  "properties": {
    "$schema": { "const": "urn:kingdom:schema:civilisation-reality-projection:0.1" },
    "protocol": { "const": "kingdom.civilisation-reality-projection/0.1" },
    "projection_id": { "const": "civilisation-reality-projection-2026-08-25" },
    "version": { "const": "0.1.0" },
    "title": { "type": "string", "minLength": 1, "maxLength": 200 },
    "compiled_on": { "const": "2026-08-25" },
    "evidence_through": { "const": "2026-08-21" },
    "state": { "const": "reviewed-thin-additive-crosswalk" },
    "scope": {
      "type": "object",
      "additionalProperties": false,
      "required": [
        "question",
        "intended_use",
        "excluded_use",
        "unit_of_analysis",
        "projection_rule",
        "open_domain_rule",
        "data_classification"
      ],
      "properties": {
        "question": { "$ref": "#/$defs/text" },
        "intended_use": { "$ref": "#/$defs/textArray" },
        "excluded_use": { "$ref": "#/$defs/textArray" },
        "unit_of_analysis": { "$ref": "#/$defs/text" },
        "projection_rule": { "$ref": "#/$defs/text" },
        "open_domain_rule": { "$ref": "#/$defs/text" },
        "data_classification": { "const": "public-static-research-crosswalk" }
      }
    },
    "projection_rules": {
      "type": "object",
      "additionalProperties": false,
      "required": [
        "source_claims_remain_in_predecessor",
        "qualified_predecessor_ids_required",
        "no_transitive_influence",
        "no_cross_register_promotion",
        "association_is_not_causation",
        "historical_claim_is_not_design_mandate",
        "design_commitment_is_not_historical_finding",
        "metaphysical_non_adjudication",
        "influence_is_non_summable",
        "no_person_community_religion_or_civilisation_score"
      ],
      "properties": {
        "source_claims_remain_in_predecessor": { "const": true },
        "qualified_predecessor_ids_required": { "const": true },
        "no_transitive_influence": { "const": true },
        "no_cross_register_promotion": { "const": true },
        "association_is_not_causation": { "const": true },
        "historical_claim_is_not_design_mandate": { "const": true },
        "design_commitment_is_not_historical_finding": { "const": true },
        "metaphysical_non_adjudication": { "const": true },
        "influence_is_non_summable": { "const": true },
        "no_person_community_religion_or_civilisation_score": { "const": true }
      }
    },
    "predecessor_bindings": {
      "type": "array",
      "minItems": 2,
      "maxItems": 2,
      "prefixItems": [
        {
          "const": {
            "id": "word-story-religion-civilisation",
            "protocol": "kingdom.word-story-religion-civilisation-map/0.1",
            "map_id": "word-story-religion-civilisation-2026-08-20",
            "locator": "repo:data/language/word-story-religion-civilisation-map.v0.1.json",
            "raw_digest": "sha256:a4a87b7b23dbdf7e7e6689b5083f76a746c7f41bc56f2124281dfda609a62479",
            "semantic_digest": "sha256:0c791b2491ebdcd85cf58e26e41e8b35b883781fd26bccc19dfd3f7853c7855a",
            "relation": "source-concept-predecessor",
            "mutated": false,
            "republished": false,
            "authority_imported": false
          }
        },
        {
          "const": {
            "id": "reality-influence-claim-graph",
            "protocol": "kingdom.reality-influence-claim-graph/0.1",
            "map_id": "reality-influence-claim-graph-2026-08-21",
            "locator": "repo:data/reality/reality-influence-map.v0.1.json",
            "raw_digest": "sha256:4d68be39226c8d5451c8d9166fa74ba54bb793b7655f119d8765090cbbcf890e",
            "semantic_digest": "sha256:45d4323d1a6190b3c333f02f2c744858e8da27944fbcb2042fbae492ca6e31ac",
            "relation": "target-claim-boundary-predecessor",
            "mutated": false,
            "republished": false,
            "authority_imported": false
          }
        }
      ],
      "items": false
    },
    "crosswalks": {
      "type": "array",
      "minItems": 6,
      "maxItems": 6,
      "items": { "$ref": "#/$defs/crosswalk" }
    },
    "open_domains": {
      "type": "array",
      "minItems": 9,
      "maxItems": 9,
      "items": { "$ref": "#/$defs/openDomain" }
    },
    "boundaries": {
      "type": "object",
      "additionalProperties": false,
      "required": [
        "read_only",
        "structure_only",
        "public_static_publication_family",
        "network",
        "filesystem_write",
        "source_dereference",
        "predecessor_files_read_for_verification",
        "predecessor_mutation",
        "predecessor_republication",
        "historical_completeness_claimed",
        "unsupported_domains_filled",
        "score_or_rank",
        "causal_claim_created",
        "metaphysical_verdict",
        "belief_identity_intent_or_emotion_inferred",
        "person_or_group_targeting",
        "persuasion_or_propaganda_design",
        "prediction_or_simulation",
        "authority_granted",
        "consent_or_lawful_basis_established",
        "action_proposed",
        "action_attempted",
        "action_executed",
        "external_effect_claimed",
        "writes_wake",
        "writes_karma",
        "publication_trigger",
        "deployment_trigger",
        "automatic_action"
      ],
      "properties": {
        "read_only": { "const": true },
        "structure_only": { "const": true },
        "public_static_publication_family": { "const": true },
        "network": { "const": false },
        "filesystem_write": { "const": false },
        "source_dereference": { "const": false },
        "predecessor_files_read_for_verification": { "const": true },
        "predecessor_mutation": { "const": false },
        "predecessor_republication": { "const": false },
        "historical_completeness_claimed": { "const": false },
        "unsupported_domains_filled": { "const": false },
        "score_or_rank": { "const": false },
        "causal_claim_created": { "const": false },
        "metaphysical_verdict": { "const": false },
        "belief_identity_intent_or_emotion_inferred": { "const": false },
        "person_or_group_targeting": { "const": false },
        "persuasion_or_propaganda_design": { "const": false },
        "prediction_or_simulation": { "const": false },
        "authority_granted": { "const": false },
        "consent_or_lawful_basis_established": { "const": false },
        "action_proposed": { "const": false },
        "action_attempted": { "const": false },
        "action_executed": { "const": false },
        "external_effect_claimed": { "const": false },
        "writes_wake": { "const": false },
        "writes_karma": { "const": false },
        "publication_trigger": { "const": false },
        "deployment_trigger": { "const": false },
        "automatic_action": { "const": false }
      }
    },
    "integrity": {
      "type": "object",
      "additionalProperties": false,
      "required": ["algorithm", "digest", "digest_field_zeroed"],
      "properties": {
        "algorithm": { "const": "sha256-recursive-sorted-json-keys-v1" },
        "digest": { "$ref": "#/$defs/digest" },
        "digest_field_zeroed": { "const": true }
      }
    }
  },
  "$defs": {
    "text": { "type": "string", "minLength": 1, "maxLength": 2000 },
    "textArray": {
      "type": "array",
      "minItems": 1,
      "maxItems": 24,
      "items": { "$ref": "#/$defs/text" }
    },
    "id": { "type": "string", "pattern": "^[a-z0-9]+(?:-[a-z0-9]+)*$", "maxLength": 120 },
    "digest": { "type": "string", "pattern": "^sha256:[a-f0-9]{64}$" },
    "crosswalk": {
      "type": "object",
      "additionalProperties": false,
      "required": [
        "id",
        "source_binding_ids",
        "source_relation_ids",
        "source_insight_ids",
        "target_domain_ids",
        "target_node_type_ids",
        "target_relation_ids",
        "target_ladder_ids",
        "target_pathway_ids",
        "register",
        "transfer_status",
        "statement",
        "preserved_distinctions",
        "required_evidence",
        "alternative_paths",
        "stop_conditions",
        "external_effect_claimed",
        "authority_granted"
      ],
      "properties": {
        "id": { "$ref": "#/$defs/id" },
        "source_binding_ids": {
          "const": ["word-story-religion-civilisation"]
        },
        "source_relation_ids": {
          "type": "array",
          "minItems": 1,
          "maxItems": 8,
          "uniqueItems": true,
          "items": {
            "enum": [
              "articulation-and-naming",
              "story-performance-memory",
              "ritual-specialist-institution",
              "sacred-order-legitimation-and-critique",
              "canon-curriculum-selection",
              "translation-contact-remaking",
              "suppression-counterstory-revival",
              "moralizing-religion-complexity-dispute"
            ]
          }
        },
        "source_insight_ids": {
          "type": "array",
          "minItems": 1,
          "maxItems": 9,
          "uniqueItems": true,
          "items": {
            "enum": [
              "coordinate-words-remain-expanded",
              "story-orients-without-proving",
              "canon-is-governance-transform",
              "ritual-is-effectful-boundary",
              "counterauthority-before-synthesis",
              "translation-preserves-seams",
              "attention-and-persistence-are-not-truth",
              "community-access-precedes-convenience",
              "polyphonic-fusion-not-unification"
            ]
          }
        },
        "target_domain_ids": {
          "type": "array",
          "minItems": 1,
          "maxItems": 12,
          "uniqueItems": true,
          "items": {
            "enum": [
              "semantic-symbolic",
              "informational-record",
              "attention-exposure",
              "social-relational",
              "institutional-status",
              "legal-jurisdictional",
              "economic-resource",
              "digital-computational",
              "material-cyberphysical",
              "embodied-health",
              "ecological",
              "normative-public"
            ]
          }
        },
        "target_node_type_ids": {
          "type": "array",
          "minItems": 1,
          "maxItems": 25,
          "uniqueItems": true,
          "items": { "type": "string", "pattern": "^[A-Z]+(?:_[A-Z]+)*$" }
        },
        "target_relation_ids": {
          "type": "array",
          "minItems": 1,
          "maxItems": 24,
          "uniqueItems": true,
          "items": { "type": "string", "pattern": "^[A-Z]+(?:_[A-Z]+)*$" }
        },
        "target_ladder_ids": {
          "type": "array",
          "minItems": 1,
          "maxItems": 17,
          "uniqueItems": true,
          "items": { "$ref": "#/$defs/id" }
        },
        "target_pathway_ids": {
          "type": "array",
          "maxItems": 4,
          "uniqueItems": true,
          "items": {
            "enum": [
              "expression-to-public-deliberation",
              "research-to-bounded-use",
              "software-to-external-aftermath",
              "challenge-to-repair"
            ]
          }
        },
        "register": { "const": "DESIGN_COMMITMENT" },
        "transfer_status": { "const": "projection-not-historical-or-causal-finding" },
        "statement": { "$ref": "#/$defs/text" },
        "preserved_distinctions": { "$ref": "#/$defs/textArray" },
        "required_evidence": { "$ref": "#/$defs/textArray" },
        "alternative_paths": { "$ref": "#/$defs/textArray" },
        "stop_conditions": { "$ref": "#/$defs/textArray" },
        "external_effect_claimed": { "const": false },
        "authority_granted": { "const": false }
      }
    },
    "openDomain": {
      "type": "object",
      "additionalProperties": false,
      "required": [
        "id",
        "question",
        "coverage_status",
        "why_not_projectable",
        "needed_evidence",
        "stop_condition"
      ],
      "properties": {
        "id": { "$ref": "#/$defs/id" },
        "question": { "$ref": "#/$defs/text" },
        "coverage_status": { "const": "not-supported-by-pinned-predecessors" },
        "why_not_projectable": { "$ref": "#/$defs/text" },
        "needed_evidence": { "$ref": "#/$defs/textArray" },
        "stop_condition": { "$ref": "#/$defs/text" }
      }
    }
  }
}
