{
  "$schema": "urn:kingdom:schema:civilisation-reality-projection:0.1",
  "protocol": "kingdom.civilisation-reality-projection/0.1",
  "projection_id": "civilisation-reality-projection-2026-08-25",
  "version": "0.1.0",
  "title": "Civilisation → Reality Projection",
  "compiled_on": "2026-08-25",
  "evidence_through": "2026-08-21",
  "state": "reviewed-thin-additive-crosswalk",
  "scope": {
    "question": "Where do the existing Word, Story, Religion & Civilisation map and the Reality Influence Claim Graph meet without pretending that either predecessor already explains war, power, class, emotion, revolution, propaganda, or governance?",
    "intended_use": [
      "Trace six exact conceptual seams between two immutable public KINGDOM predecessors.",
      "Make translation loss and unsupported domains visible before any broader civilisation atlas is proposed.",
      "Provide a small inspectable discovery surface for humans and machines."
    ],
    "excluded_use": [
      "A theory, score, ranking, prediction, simulator, or causal model of civilisation.",
      "A theological adjudication, belief inference, persuasion system, propaganda design, or person or group targeting tool.",
      "A source of authority, consent, lawful basis, operational instruction, action, publication trigger, or deployment trigger."
    ],
    "unit_of_analysis": "One explicitly lossy crosswalk between named source concepts in the civilisation map and named target concepts in the reality claim graph.",
    "projection_rule": "A crosswalk records a possible reading between already-published concepts; it neither merges their types nor extends, proves, or transfers either predecessor's claims.",
    "open_domain_rule": "If the two bound predecessors do not carry enough typed evidence for a requested domain, the domain remains open and no placeholder mechanism is invented.",
    "data_classification": "public-static-research-crosswalk"
  },
  "projection_rules": {
    "source_claims_remain_in_predecessor": true,
    "qualified_predecessor_ids_required": true,
    "no_transitive_influence": true,
    "no_cross_register_promotion": true,
    "association_is_not_causation": true,
    "historical_claim_is_not_design_mandate": true,
    "design_commitment_is_not_historical_finding": true,
    "metaphysical_non_adjudication": true,
    "influence_is_non_summable": true,
    "no_person_community_religion_or_civilisation_score": true
  },
  "predecessor_bindings": [
    {
      "id": "word-story-religion-civilisation",
      "protocol": "kingdom.word-story-religion-civilisation-map/0.1",
      "map_id": "word-story-religion-civilisation-2026-08-20",
      "locator": "repo:data/language/word-story-religion-civilisation-map.v0.1.json",
      "raw_digest": "sha256:a4a87b7b23dbdf7e7e6689b5083f76a746c7f41bc56f2124281dfda609a62479",
      "semantic_digest": "sha256:0c791b2491ebdcd85cf58e26e41e8b35b883781fd26bccc19dfd3f7853c7855a",
      "relation": "source-concept-predecessor",
      "mutated": false,
      "republished": false,
      "authority_imported": false
    },
    {
      "id": "reality-influence-claim-graph",
      "protocol": "kingdom.reality-influence-claim-graph/0.1",
      "map_id": "reality-influence-claim-graph-2026-08-21",
      "locator": "repo:data/reality/reality-influence-map.v0.1.json",
      "raw_digest": "sha256:4d68be39226c8d5451c8d9166fa74ba54bb793b7655f119d8765090cbbcf890e",
      "semantic_digest": "sha256:45d4323d1a6190b3c333f02f2c744858e8da27944fbcb2042fbae492ca6e31ac",
      "relation": "target-claim-boundary-predecessor",
      "mutated": false,
      "republished": false,
      "authority_imported": false
    }
  ],
  "crosswalks": [
    {
      "id": "naming-to-expression",
      "source_binding_ids": [
        "word-story-religion-civilisation"
      ],
      "source_relation_ids": [
        "articulation-and-naming"
      ],
      "source_insight_ids": [
        "coordinate-words-remain-expanded"
      ],
      "target_domain_ids": [
        "semantic-symbolic",
        "informational-record"
      ],
      "target_node_type_ids": [
        "EXPRESSION",
        "CLAIM_ASSESSMENT"
      ],
      "target_relation_ids": [
        "EXPRESSES"
      ],
      "target_ladder_ids": [
        "expression-recorded"
      ],
      "target_pathway_ids": [
        "expression-to-public-deliberation"
      ],
      "register": "DESIGN_COMMITMENT",
      "transfer_status": "projection-not-historical-or-causal-finding",
      "statement": "A word, name, or invocation may be represented as an attributed expression record before any artifact, circulation, uptake, belief, authority, or effect claim.",
      "preserved_distinctions": [
        "Word or name remains distinct from sacred referent, truth, belief, understanding, uptake, and world state.",
        "An EXPRESSION node does not import every language-specific or tradition-specific semantic coordinate."
      ],
      "required_evidence": [
        "An attributable expression and its bounded context.",
        "Separate records for any later artifact, distribution, response, decision, or outcome claim."
      ],
      "alternative_paths": [
        "The expression may remain private, untranslated, contested, refused, forgotten, or never materialized.",
        "Different communities may retain non-equivalent referent and interpretation charts."
      ],
      "stop_conditions": [
        "Stop before claiming referent identity, theological truth, belief, understanding, agreement, or causal influence.",
        "Stop when attribution or the relevant language and community context cannot be supported."
      ],
      "external_effect_claimed": false,
      "authority_granted": false
    },
    {
      "id": "story-to-public-deliberation",
      "source_binding_ids": [
        "word-story-religion-civilisation"
      ],
      "source_relation_ids": [
        "story-performance-memory"
      ],
      "source_insight_ids": [
        "story-orients-without-proving"
      ],
      "target_domain_ids": [
        "semantic-symbolic",
        "informational-record",
        "attention-exposure",
        "normative-public"
      ],
      "target_node_type_ids": [
        "EXPRESSION",
        "ARTIFACT",
        "DISTRIBUTION_OBSERVATION",
        "ATTENTION_OBSERVATION",
        "PUBLIC_RESPONSE_RECORD"
      ],
      "target_relation_ids": [
        "EMBODIES_EXPRESSION",
        "DISTRIBUTES_ARTIFACT",
        "MEASURES_EXPOSURE_TO",
        "REPORTS_PUBLIC_RESPONSE_TO"
      ],
      "target_ladder_ids": [
        "expression-recorded",
        "artifact-versioned",
        "distribution-witnessed",
        "exposure-measured",
        "public-response-attributed"
      ],
      "target_pathway_ids": [
        "expression-to-public-deliberation"
      ],
      "register": "DESIGN_COMMITMENT",
      "transfer_status": "projection-not-historical-or-causal-finding",
      "statement": "A story or teaching may be traced as expression, versioned artifact, witnessed distribution and exposure, and attributed public response only when each stage has separate evidence.",
      "preserved_distinctions": [
        "Narrative memory, ritual performance, exposure, response, private belief, agreement, and collective decision remain different events.",
        "Orientation or public response does not prove truth, consensus, consent, legitimacy, or causal influence."
      ],
      "required_evidence": [
        "Versioned artifact provenance and separately scoped distribution, exposure, and response witnesses.",
        "Alternative explanations and explicit limits for any association claim."
      ],
      "alternative_paths": [
        "A story may circulate without measurable exposure or public response.",
        "Similar public responses may arise from institutions, material conditions, prior commitments, other stories, or unobserved causes."
      ],
      "stop_conditions": [
        "Stop at the last independently evidenced stage in the public-deliberation pathway.",
        "Stop before inferring private belief, consensus, consent, legitimacy, persuasion, or causal effect."
      ],
      "external_effect_claimed": false,
      "authority_granted": false
    },
    {
      "id": "canon-to-selection-feedback",
      "source_binding_ids": [
        "word-story-religion-civilisation"
      ],
      "source_relation_ids": [
        "canon-curriculum-selection"
      ],
      "source_insight_ids": [
        "canon-is-governance-transform",
        "attention-and-persistence-are-not-truth"
      ],
      "target_domain_ids": [
        "attention-exposure",
        "social-relational",
        "institutional-status",
        "normative-public"
      ],
      "target_node_type_ids": [
        "ARTIFACT",
        "DISTRIBUTION_OBSERVATION",
        "ATTENTION_OBSERVATION",
        "ACTION_PROPOSAL",
        "DECISION_RECORD",
        "FEEDBACK_ITEM"
      ],
      "target_relation_ids": [
        "DERIVES_FROM",
        "SELECTS_PROPOSAL",
        "CHALLENGES",
        "CORRECTS",
        "SUPERSEDES",
        "WITHDRAWS"
      ],
      "target_ladder_ids": [
        "artifact-versioned",
        "distribution-witnessed",
        "exposure-measured",
        "proposal-recorded",
        "decision-recorded"
      ],
      "target_pathway_ids": [
        "expression-to-public-deliberation",
        "research-to-bounded-use"
      ],
      "register": "DESIGN_COMMITMENT",
      "transfer_status": "projection-not-historical-or-causal-finding",
      "statement": "Canon and curriculum selection may be inspected as artifact selection, distribution, attention, proposal, decision, challenge, correction, supersession, and withdrawal records rather than as a single truth or influence score.",
      "preserved_distinctions": [
        "Selection of texts, selection of a proposal, institutional authorization, and actual adoption are not the same operation.",